{
  "protocol": "AI-CONTEXT/INTEROP-CONFORMANCE",
  "schema_version": "0.1.0",
  "canonicalizer": "python-json-v0.1",
  "canonicalization_vectors": [
    {
      "name": "object-order",
      "input": {"z": 1, "a": "alpha", "nested": {"b": true, "a": null}},
      "python_json_v0_1_utf8_hex": "7b2261223a22616c706861222c226e6573746564223a7b2261223a6e756c6c2c2262223a747275657d2c227a223a317d",
      "sha256": "4a40d3b88b51a93f54f1e69efb6174717159c99cb6885c2b0781d37ac61fa52c"
    },
    {
      "name": "unicode",
      "input": {"text": "Καλημέρα 世界 😀", "é": "composed", "é": "decomposed"},
      "python_json_v0_1_utf8_hex": "7b2265cc81223a226465636f6d706f736564222c2274657874223a22ce9aceb1cebbceb7cebcceadcf81ceb120e4b896e7958c20f09f9880222c22c3a9223a22636f6d706f736564227d",
      "sha256": "0d44db854fc22b9e91982b659bac6edc99e19b9d098d2e3757212a31a280a60f"
    },
    {
      "name": "numbers-safe",
      "input": {"zero": 0, "neg": -7, "fraction": 1.25, "large": 9007199254740991},
      "python_json_v0_1_utf8_hex": "7b226672616374696f6e223a312e32352c226c61726765223a393030373139393235343734303939312c226e6567223a2d372c227a65726f223a307d",
      "sha256": "cd34bcd700dce79e3f439b90e694625fac04da7cb150c56157947cb2a6d4c1f0"
    },
    {
      "name": "arrays",
      "input": {"items": [3, "three", false, null, {"x": "y"}]},
      "python_json_v0_1_utf8_hex": "7b226974656d73223a5b332c227468726565222c66616c73652c6e756c6c2c7b2278223a2279227d5d7d",
      "sha256": "a2dc98847ce05ab370e5ede8ed01c20039c3c5ed78b8b6a7a4fb4c3beafc0754"
    }
  ],
  "signed_receipt_public_vector": {
    "bundle_sha256": "47c4be2ece1c08b69b3f658ece3e0d24ebecb7af643dc55750a53a97f7fbacb7",
    "bundle_payload_sha256": "2d7c09188d414c888f37b661e27aecdd54231e027ea2c8ad9c1e313aab34c5d9",
    "canonical_store_sha256": "0e7e42a29213f9d68d1d4d2f2f4715f7642f604a7847b10b3da0b0eebb331ab3",
    "signer_key_id": "ed25519.sha256:4999d26fcb333b5065a93dc1d1fd6d9c92b385fdcbd3ea8ce01484251cfc122b",
    "public_key_b64": "y1iLkyIFWI7/4kBy5Kq6CTkKTt5NBA4bnM9KPUc43To=",
    "signature_b64": "b7Az6Oq8h5q3EVJGc/Q4/90v8EQegt213d33AJ455fmbeKGVUj9FN93EGqhdeftiIM+Q/s8IiLRlmMwxGchkAw==",
    "signature_preimage_hex": "41492d434f4e544558542f5349474e45442d42554e444c452d5245434549505400302e312e30004564323535313900343763346265326563653163303862363962336636353865636533653064323465626563623761663634336463353537353061353361393766376662616362370032643763303931383864343134633838386633376236363165323761656364643534323331653032376561326338616439633165333133616162333463356439003065376534326132393231336639643638643164346432663266343731356637363432663630346137383437623130623364613062306565626233333161623300656432353531392e7368613235363a3439393964323666636233333362353036356139336463316431666436643963393262333835666463626433656138636530313438343235316366633132326200",
    "signature_preimage_sha256": "18a43718147b8c35fdb529a0d4077f9d13155055c769791211d5b962fde6473f"
  }
}
